{
  "contract": "1",
  "kernel": "a227fb",
  "graph": "a431fa",
  "version": "0.4.0",
  "endpoint": "local-daemon",
  "port": 18731,
  "nodes": 1401,
  "design": {
    "from": "files",
    "fingerprint": "0fe5f2c4324025fc3ee2964ec86716b0384bd23fa795a44e95602b9e71611d52"
  },
  "data": [
    "solar-drivers@2026.09.04#54784567db11b868",
    "solar-weather@2026.09.14#f3557eb8443bfdaa"
  ]
}
